{
    "$schema": "https://raw.githubusercontent.com/AuburnSounds/dplug/master/plugin-schema.json",

    "vendorName": "Witty Audio",
    "vendorUniqueID": "Wity",
    "vendorSupportEmail": "support@wittyaudio.com",

    "pluginName": "Destructatorizer",
    "pluginHomepage": "https://www.wittyaudio.com/Destructatorizer",
    "pluginUniqueID": "WiDi",
    "publicVersion": "1.0.0",
    "CFBundleIdentifierPrefix": "com.wittyaudio",
    "hasGUI": true,
    "category": "effectDistortion"
}