{
    "pluginName":               "Template",
    "publicVersion":            "1.0.0",
    "pluginUniqueID":           "WiTe",
    "pluginHomepage":           "https://www.wittyaudio.com/Template",
    "hasGUI":                   true,
    "category":                 "effectOther",
    "licensePath":              "license.md",

    "vendorName":               "Witty Audio",
    "vendorUniqueID":           "Wity",
    "vendorSupportEmail":       "support@wittyaudio.com",
    "CFBundleIdentifierPrefix": "com.wittyaudio"
}